11:35:49.229539 IP apsit-HP-280-G3-MT.55454 > _gateway.8090: Flags [F.], seq 47357658, ack 3082524658, win 237, length 0
11:35:49.244994 IP 192.168.2.94.netbios-ns > 192.168.255.255.netbios-ns: UDP, length 50
11:35:49.249494 IP6 fe80::ee58:eaff:fe08:2090 > ff02::16: HBH ICMP6, multicast listener report v2, 1 group record(s), length 28
11:35:49.270061 IP 192.168.8.38.40620 > 239.255.255.250.1900: UDP, length 171
11:35:49.271437 IP 192.168.3.127.47655 > 239.255.255.250.1900: UDP, length 172
11:35:49.311696 IP 192.168.69.238.mdns > 224.0.0.251.mdns: 0 PTR (QM)? _communicator._tcp.local. (42)
11:35:49.311824 IP6 fe80::ee58:eaff:fe08:2090.mdns > ff02::fb.mdns: 0 PTR (QM)? _communicator._tcp.local. (42)
11:35:49.329188 ARP, Request who-has 169.254.169.254 tell 192.168.2.191, length 46
11:35:49.337427 IP6 fe80::e464:5c51:ed19:e221.49951 > ff02::1:3.hostmon: UDP, length 28
11:35:49.337429 IP 192.168.5.81.49951 > 224.0.0.252.hostmon: UDP, length 28
11:35:49.339709 IP6 fe80::e464:5c51:ed19:e221.61751 > ff02::1:3.hostmon: UDP, length 28
11:35:49.339711 IP 192.168.5.81.61751 > 224.0.0.252.hostmon: UDP, length 28
11:35:49.376099 IP 192.168.3.6.64130 > 239.255.255.250.1900: UDP, length 173
11:35:49.383938 IP 192.168.5.81.netbios-ns > 192.168.255.255.netbios-ns: UDP, length 50
11:35:49.397364 IP6 fe80::a175:3746:6436:61e2.mdns > ff02::fb.mdns: 0 [1a] [7q] PTR (QM)? _ftp._tcp.local. PTR (QM)? _nfs._tcp.local. PTR (QM)? _afpovertcp._tcp.local. PTR (QM)? _smb._tcp.local. PTR (QM)? _sftp-ssh._tcp.local. PTR (QM)? _webdavs._tcp.local. PTR (QM)? _webdav._tcp.local. (151)
11:35:49.397369 IP 192.168.3.109.mdns > 224.0.0.251.mdns: 0 [1a] [7q] PTR (QM)? _ftp._tcp.local. PTR (QM)? _nfs._tcp.local. PTR (QM)? _afpovertcp._tcp.local. PTR (QM)? _smb._tcp.local. PTR (QM)? _sftp-ssh._tcp.local. PTR (QM)? _webdavs._tcp.local. PTR (QM)? _webdav._tcp.local. (151)
11:35:49.421699 ARP, Request who-has 192.168.86.159 tell 192.168.2.115, length 46
11:35:49.421702 ARP, Request who-has 192.168.86.161 tell 192.168.2.115, length 46
11:35:49.421702 ARP, Request who-has 192.168.86.158 tell 192.168.2.115, length 46
11:35:49.437325 ARP, Request who-has 192.168.86.157 tell 192.168.2.115, length 46
11:35:49.437327 ARP, Request who-has 192.168.86.160 tell 192.168.2.115, length 46
11:35:49.437329 ARP, Request who-has 192.168.86.162 tell 192.168.2.115, length 46
11:35:49.437330 ARP, Request who-has 192.168.86.156 tell 192.168.2.115, length 46
11:35:49.437330 ARP, Request who-has 192.168.86.163 tell 192.168.2.115, length 46
11:35:49.437331 ARP, Request who-has 192.168.86.164 tell 192.168.2.115, length 46
11:35:49.494029 IP 192.168.3.168.45763 > 239.255.255.250.1900: UDP, length 171
11:35:49.494267 IP 192.168.2.94.mdns > 224.0.0.251.mdns: 0 A (QM)? 6EF946000000.local. (36)
11:35:49.494276 IP6 fe80::7c9d:509e:d0f9:3cb3.mdns > ff02::fb.mdns: 0 A (QM)? 6EF946000000.local. (36)
11:35:49.496152 IP 192.168.2.94.mdns > 224.0.0.251.mdns: 0 AAAA (QM)? 6EF946000000.local. (36)
11:35:49.496159 IP6 fe80::7c9d:509e:d0f9:3cb3.mdns > ff02::fb.mdns: 0 AAAA (QM)? 6EF946000000.local. (36)
11:35:49.502987 ARP, Request who-has 192.168.3.161 tell 192.168.2.187, length 46
11:35:49.549460 IP6 fe80::ee58:eaff:fe08:2090 > ff02::16: HBH ICMP6, multicast listener report v2, 1 group record(s), length 28
11:35:49.568046 ARP, Request who-has 192.168.86.128 tell 192.168.2.115, length 46
11:35:49.568048 ARP, Request who-has 192.168.86.132 tell 192.168.2.115, length 46
11:35:49.568049 ARP, Request who-has 192.168.86.136 tell 192.168.2.115, length 46
11:35:49.568050 ARP, Request who-has 192.168.86.137 tell 192.168.2.115, length 46
11:35:49.568050 ARP, Request who-has 192.168.86.133 tell 192.168.2.115, length 46
11:35:49.568051 ARP, Request who-has 192.168.86.152 tell 192.168.2.115, length 46
11:35:49.568051 ARP, Request who-has 192.168.86.151 tell 192.168.2.115, length 46
11:35:49.568052 ARP, Request who-has 192.168.86.139 tell 192.168.2.115, length 46
11:35:49.568053 ARP, Request who-has 192.168.86.140 tell 192.168.2.115, length 46
11:35:49.568054 ARP, Request who-has 192.168.86.148 tell 192.168.2.115, length 46
11:35:49.568054 ARP, Request who-has 192.168.86.147 tell 192.168.2.115, length 46
11:35:49.568055 ARP, Request who-has 192.168.86.144 tell 192.168.2.115, length 46
11:35:49.568055 ARP, Request who-has 192.168.86.143 tell 192.168.2.115, length 46
11:35:49.568056 ARP, Request who-has 192.168.86.149 tell 192.168.2.115, length 46
11:35:49.568057 ARP, Request who-has 192.168.86.146 tell 192.168.2.115, length 46
11:35:49.568058 ARP, Request who-has 192.168.86.154 tell 192.168.2.115, length 46
11:35:49.568058 ARP, Request who-has 192.168.86.145 tell 192.168.2.115, length 46
11:35:49.568059 ARP, Request who-has 192.168.86.153 tell 192.168.2.115, length 46
11:35:49.568059 ARP, Request who-has 192.168.86.150 tell 192.168.2.115, length 46
11:35:49.568060 ARP, Request who-has 192.168.86.142 tell 192.168.2.115, length 46
11:35:49.568148 ARP, Request who-has 192.168.86.138 tell 192.168.2.115, length 46
11:35:49.568151 ARP, Request who-has 192.168.86.141 tell 192.168.2.115, length 46
11:35:49.568152 ARP, Request who-has 192.168.86.218 tell 192.168.2.115, length 46
11:35:49.568152 ARP, Request who-has 192.168.86.219 tell 192.168.2.115, length 46
11:35:49.568153 ARP, Request who-has 192.168.86.220 tell 192.168.2.115, length 46
11:35:49.568153 ARP, Request who-has 192.168.86.222 tell 192.168.2.115, length 46
11:35:49.568154 ARP, Request who-has 192.168.86.223 tell 192.168.2.115, length 46
11:35:49.568155 ARP, Request who-has 192.168.86.221 tell 192.168.2.115, length 46
11:35:49.568156 ARP, Request who-has 192.168.86.224 tell 192.168.2.115, length 46
11:35:49.568156 ARP, Request who-has 192.168.86.225 tell 192.168.2.115, length 46
11:35:49.568157 ARP, Request who-has 192.168.86.226 tell 192.168.2.115, length 46
11:35:49.568157 ARP, Request who-has 192.168.86.227 tell 192.168.2.115, length 46
11:35:49.568228 ARP, Request who-has 192.168.86.228 tell 192.168.2.115, length 46
11:35:49.579977 IP 192.168.69.237.12223 > 192.168.255.255.12223: LWAPPv0, Data frame, Flags [Last Fragment Bit], length 335
11:35:49.582120 IP6 fe80::e464:5c51:ed19:e221.50091 > ff02::1:3.hostmon: UDP, length 28
11:35:49.582122 IP 192.168.5.81.50091 > 224.0.0.252.hostmon: UDP, length 28
11:35:49.584060 IP6 fe80::e464:5c51:ed19:e221.58105 > ff02::1:3.hostmon: UDP, length 28
11:35:49.584062 IP 192.168.5.81.58105 > 224.0.0.252.hostmon: UDP, length 28
11:35:49.624591 ARP, Request who-has 10.240.254.112 tell 10.10.19.229, length 46
11:35:49.642901 ARP, Request who-has 192.168.2.15 tell 192.168.3.93, length 46
11:35:49.688809 IP 192.168.4.94.40800 > 239.255.255.250.1900: UDP, length 172
11:35:49.698600 IP 192.168.69.241.12223 > 192.168.255.255.12223: LWAPPv0, Data frame, Flags [Last Fragment Bit], length 334
11:35:49.702144 IP ec2-3-109-249-192.ap-south-1.compute.amazonaws.com.xmpp-client > 192.168.2.39.46622: Flags [F.], seq 2355464361, ack 1796190130, win 181, options [nop,nop,TS val 3434890144 ecr 28964971], length 0
11:35:49.758426 ARP, Request who-has 192.168.100.230 tell 192.168.25.29, length 46
11:35:49.759262 ARP, Request who-has 192.168.86.165 tell 192.168.2.115, length 46
11:35:49.788719 IP 192.168.4.95.58559 > 239.255.255.250.1900: UDP, length 174
11:35:49.794632 ARP, Request who-has 10.1.1.69 tell 10.10.19.229, length 46
11:35:49.842548 IP 192.168.3.158.35740 > 239.255.255.250.1900: UDP, length 171
11:35:49.845996 ARP, Request who-has 192.168.5.1 tell 192.168.89.20, length 46
11:35:49.867891 IP6 fe80::5e27:ff39:933e:57f4.mdns > ff02::fb.mdns: 0 PTR (QM)? _daap._tcp.local. (34)
11:35:49.867901 IP 192.168.2.246.mdns > 224.0.0.251.mdns: 0 PTR (QM)? _daap._tcp.local. (34)
11:35:49.909304 ARP, Request who-has 192.168.2.90 tell 192.168.2.187, length 46
11:35:49.909736 IP 192.168.19.188.37100 > 239.255.255.250.1900: UDP, length 171
11:35:49.923883 IP6 fe80::291f:9a3b:8a82:e6fb.dhcpv6-client > ff02::1:2.dhcpv6-server: dhcp6 solicit
11:35:50.005915 IP 192.168.2.94.netbios-ns > 192.168.255.255.netbios-ns: UDP, length 50
11:35:50.051278 IP 192.168.2.116.49814 > 239.255.255.250.1900: UDP, length 125
11:35:50.077072 ARP, Request who-has 192.168.86.124 tell 192.168.2.115, length 46
11:35:50.077095 ARP, Request who-has 192.168.86.188 tell 192.168.2.115, length 46
11:35:50.077097 ARP, Request who-has 192.168.86.125 tell 192.168.2.115, length 46
11:35:50.077099 ARP, Request who-has 192.168.86.126 tell 192.168.2.115, length 46
11:35:50.077100 ARP, Request who-has 192.168.86.189 tell 192.168.2.115, length 46
11:35:50.077102 ARP, Request who-has 192.168.86.159 tell 192.168.2.115, length 46
11:35:50.077105 ARP, Request who-has 192.168.86.161 tell 192.168.2.115, length 46
11:35:50.077107 ARP, Request who-has 192.168.86.158 tell 192.168.2.115, length 46
11:35:50.077110 ARP, Request who-has 192.168.86.157 tell 192.168.2.115, length 46
11:35:50.077111 ARP, Request who-has 192.168.86.160 tell 192.168.2.115, length 46
11:35:50.077112 ARP, Request who-has 192.168.86.162 tell 192.168.2.115, length 46
11:35:50.077114 ARP, Request who-has 192.168.86.156 tell 192.168.2.115, length 46
11:35:50.077118 ARP, Request who-has 192.168.86.163 tell 192.168.2.115, length 46
11:35:50.077120 ARP, Request who-has 192.168.86.164 tell 192.168.2.115, length 46
11:35:50.077121 ARP, Request who-has 192.168.86.229 tell 192.168.2.115, length 46
11:35:50.077122 ARP, Request who-has 192.168.86.230 tell 192.168.2.115, length 46
11:35:50.092935 IP 192.168.2.250.61588 > 239.255.255.250.1900: UDP, length 173
11:35:50.126138 IP apsit-HP-280-G3-MT.52129 > ns1.jeebr.net.domain: 20182+ PTR? 193.192.168.192.in-addr.arpa. (46)
11:35:50.127977 IP ns1.jeebr.net.domain > apsit-HP-280-G3-MT.52129: 20182 NXDomain 0/1/0 (95)
11:35:50.128606 IP apsit-HP-280-G3-MT.35381 > ns1.jeebr.net.domain: 16806+ PTR? 184.19.168.192.in-addr.arpa. (45)
11:35:50.130674 IP ns1.jeebr.net.domain > apsit-HP-280-G3-MT.35381: 16806 NXDomain 0/1/0 (94)
11:35:50.130984 IP apsit-HP-280-G3-MT.39723 > ns1.jeebr.net.domain: 30803+ PTR? 255.255.168.192.in-addr.arpa. (46)
11:35:50.132670 IP ns1.jeebr.net.domain > apsit-HP-280-G3-MT.39723: 30803 NXDomain 0/1/0 (95)
11:35:50.133144 IP apsit-HP-280-G3-MT.36793 > ns1.jeebr.net.domain: 48156+ PTR? 94.2.168.192.in-addr.arpa. (43)
11:35:50.134635 IP ns1.jeebr.net.domain > apsit-HP-280-G3-MT.36793: 48156 NXDomain 0/1/0 (92)
11:35:50.135064 IP apsit-HP-280-G3-MT.40246 > ns1.jeebr.net.domain: 45108+ PTR? 6.1.0.0.0.0.0.0.0.0.0.0.0.0.0.0.0.0.0.0.0.0.0.0.0.0.0.0.2.0.f.f.ip6.arpa. (90)
11:35:50.140806 IP ns1.jeebr.net.domain > apsit-HP-280-G3-MT.40246: 45108 NXDomain 0/1/0 (154)
11:35:50.142148 IP apsit-HP-280-G3-MT.34488 > ns1.jeebr.net.domain: 41828+ PTR? 250.255.255.239.in-addr.arpa. (46)
11:35:50.143238 ARP, Request who-has 192.168.86.167 tell 192.168.2.115, length 46
11:35:50.144324 IP ns1.jeebr.net.domain > apsit-HP-280-G3-MT.34488: 41828 NXDomain 0/1/0 (103)
11:35:50.145153 IP apsit-HP-280-G3-MT.58931 > ns1.jeebr.net.domain: 58190+ PTR? 38.8.168.192.in-addr.arpa. (43)
11:35:50.147054 IP ns1.jeebr.net.domain > apsit-HP-280-G3-MT.58931: 58190 NXDomain 0/1/0 (92)
11:35:50.147392 IP apsit-HP-280-G3-MT.49094 > ns1.jeebr.net.domain: 21094+ PTR? 127.3.168.192.in-addr.arpa. (44)
11:35:50.148825 IP ns1.jeebr.net.domain > apsit-HP-280-G3-MT.49094: 21094 NXDomain 0/1/0 (93)
11:35:50.149163 IP apsit-HP-280-G3-MT.43386 > ns1.jeebr.net.domain: 37943+ PTR? 251.0.0.224.in-addr.arpa. (42)
11:35:50.149303 IP 192.168.5.81.netbios-ns > 192.168.255.255.netbios-ns: UDP, length 50
11:35:50.151282 IP ns1.jeebr.net.domain > apsit-HP-280-G3-MT.43386: 37943 NXDomain 0/1/0 (99)
11:35:50.151609 IP apsit-HP-280-G3-MT.52262 > ns1.jeebr.net.domain: 36576+ PTR? 238.69.168.192.in-addr.arpa. (45)
11:35:50.153381 IP ns1.jeebr.net.domain > apsit-HP-280-G3-MT.52262: 36576 NXDomain 0/1/0 (94)
11:35:50.154182 IP apsit-HP-280-G3-MT.36854 > ns1.jeebr.net.domain: 25099+ PTR? b.f.0.0.0.0.0.0.0.0.0.0.0.0.0.0.0.0.0.0.0.0.0.0.0.0.0.0.2.0.f.f.ip6.arpa. (90)
11:35:50.156464 IP ns1.jeebr.net.domain > apsit-HP-280-G3-MT.36854: 25099 NXDomain 0/1/0 (154)
11:35:50.158857 ARP, Request who-has 192.168.86.170 tell 192.168.2.115, length 46
11:35:50.158860 ARP, Request who-has 192.168.86.168 tell 192.168.2.115, length 46
11:35:50.158861 ARP, Request who-has 192.168.86.169 tell 192.168.2.115, length 46
11:35:50.174585 ARP, Request who-has 192.168.86.179 tell 192.168.2.115, length 46
11:35:50.174590 ARP, Request who-has 192.168.86.172 tell 192.168.2.115, length 46
11:35:50.174591 ARP, Request who-has 192.168.86.171 tell 192.168.2.115, length 46
11:35:50.174591 ARP, Request who-has 192.168.86.178 tell 192.168.2.115, length 46
11:35:50.174592 ARP, Request who-has 192.168.86.182 tell 192.168.2.115, length 46
11:35:50.174593 ARP, Request who-has 192.168.86.176 tell 192.168.2.115, length 46
11:35:50.174593 ARP, Request who-has 192.168.86.175 tell 192.168.2.115, length 46
11:35:50.174594 ARP, Request who-has 192.168.86.177 tell 192.168.2.115, length 46
11:35:50.174594 ARP, Request who-has 192.168.86.174 tell 192.168.2.115, length 46
11:35:50.174595 ARP, Request who-has 192.168.86.173 tell 192.168.2.115, length 46
11:35:50.174596 ARP, Request who-has 192.168.86.183 tell 192.168.2.115, length 46
11:35:50.179466 ARP, Request who-has 192.168.86.180 tell 192.168.2.115, length 46
11:35:50.179469 ARP, Request who-has 192.168.86.181 tell 192.168.2.115, length 46
11:35:50.257108 IP6 apsit-HP-280-G3-MT.mdns > ff02::fb.mdns: 0 PTR (QM)? 254.169.254.169.in-addr.arpa. (46)
11:35:50.257139 IP apsit-HP-280-G3-MT.mdns > 224.0.0.251.mdns: 0 PTR (QM)? 254.169.254.169.in-addr.arpa. (46)
11:35:50.271080 IP 192.168.8.38.40620 > 239.255.255.250.1900: UDP, length 171
11:35:50.272130 IP 192.168.3.127.47655 > 239.255.255.250.1900: UDP, length 172
11:35:50.279811 ARP, Request who-has 169.254.169.254 tell 192.168.2.191, length 46
11:35:50.313808 IP 192.168.69.238.mdns > 224.0.0.251.mdns: 0 PTR (QM)? _communicator._tcp.local. (42)
11:35:50.313930 IP6 fe80::ee58:eaff:fe08:2090.mdns > ff02::fb.mdns: 0 PTR (QM)? _communicator._tcp.local. (42)
11:35:50.347286 ARP, Request who-has 192.168.86.186 tell 192.168.2.115, length 46
11:35:50.347289 ARP, Request who-has 192.168.86.185 tell 192.168.2.115, length 46
11:35:50.354014 IP 192.168.2.116.49814 > 239.255.255.250.1900: UDP, length 125
11:35:50.376296 IP 192.168.3.6.64130 > 239.255.255.250.1900: UDP, length 173
11:35:50.449861 IP 192.168.8.44.33627 > 239.255.255.250.1900: UDP, length 166
11:35:50.494916 IP 192.168.3.168.45763 > 239.255.255.250.1900: UDP, length 171
11:35:50.502517 ARP, Request who-has 192.168.3.161 tell 192.168.2.187, length 46
11:35:50.502519 ARP, Request who-has 192.168.2.90 tell 192.168.2.187, length 46
11:35:50.571653 ARP, Request who-has 192.168.86.128 tell 192.168.2.115, length 46
11:35:50.571655 ARP, Request who-has 192.168.86.132 tell 192.168.2.115, length 46
11:35:50.571656 ARP, Request who-has 192.168.86.136 tell 192.168.2.115, length 46
11:35:50.571657 ARP, Request who-has 192.168.86.137 tell 192.168.2.115, length 46
11:35:50.571657 ARP, Request who-has 192.168.86.133 tell 192.168.2.115, length 46
11:35:50.571658 ARP, Request who-has 192.168.86.152 tell 192.168.2.115, length 46
11:35:50.571659 ARP, Request who-has 192.168.86.151 tell 192.168.2.115, length 46
11:35:50.571660 ARP, Request who-has 192.168.86.139 tell 192.168.2.115, length 46
11:35:50.571660 ARP, Request who-has 192.168.86.140 tell 192.168.2.115, length 46
11:35:50.571661 ARP, Request who-has 192.168.86.148 tell 192.168.2.115, length 46
11:35:50.571662 ARP, Request who-has 192.168.86.147 tell 192.168.2.115, length 46
11:35:50.571662 ARP, Request who-has 192.168.86.144 tell 192.168.2.115, length 46
11:35:50.571663 ARP, Request who-has 192.168.86.143 tell 192.168.2.115, length 46
11:35:50.571664 ARP, Request who-has 192.168.86.149 tell 192.168.2.115, length 46
11:35:50.571726 ARP, Request who-has 192.168.86.146 tell 192.168.2.115, length 46
11:35:50.571728 ARP, Request who-has 192.168.86.154 tell 192.168.2.115, length 46
11:35:50.571728 ARP, Request who-has 192.168.86.145 tell 192.168.2.115, length 46
11:35:50.571729 ARP, Request who-has 192.168.86.153 tell 192.168.2.115, length 46
11:35:50.571730 ARP, Request who-has 192.168.86.150 tell 192.168.2.115, length 46
11:35:50.571731 ARP, Request who-has 192.168.86.142 tell 192.168.2.115, length 46
11:35:50.571732 ARP, Request who-has 192.168.86.138 tell 192.168.2.115, length 46
11:35:50.571733 ARP, Request who-has 192.168.86.141 tell 192.168.2.115, length 46
11:35:50.571733 ARP, Request who-has 192.168.86.218 tell 192.168.2.115, length 46
11:35:50.571734 ARP, Request who-has 192.168.86.165 tell 192.168.2.115, length 46
11:35:50.571734 ARP, Request who-has 192.168.86.231 tell 192.168.2.115, length 46
11:35:50.571735 ARP, Request who-has 192.168.86.232 tell 192.168.2.115, length 46
11:35:50.571822 ARP, Request who-has 192.168.86.233 tell 192.168.2.115, length 46
11:35:50.571824 ARP, Request who-has 192.168.86.234 tell 192.168.2.115, length 46
11:35:50.571826 ARP, Request who-has 192.168.86.235 tell 192.168.2.115, length 46
11:35:50.571826 ARP, Request who-has 192.168.86.236 tell 192.168.2.115, length 46
11:35:50.571827 ARP, Request who-has 192.168.86.237 tell 192.168.2.115, length 46
11:35:50.571828 ARP, Request who-has 192.168.86.238 tell 192.168.2.115, length 46
11:35:50.571829 ARP, Request who-has 192.168.86.239 tell 192.168.2.115, length 46
11:35:50.571829 ARP, Request who-has 192.168.86.240 tell 192.168.2.115, length 46
11:35:50.571830 ARP, Request who-has 192.168.86.241 tell 192.168.2.115, length 46
11:35:50.571830 ARP, Request who-has 192.168.86.242 tell 192.168.2.115, length 46
11:35:50.571831 ARP, Request who-has 192.168.86.243 tell 192.168.2.115, length 46
11:35:50.571832 ARP, Request who-has 192.168.86.244 tell 192.168.2.115, length 46
11:35:50.571923 ARP, Request who-has 192.168.86.245 tell 192.168.2.115, length 46
11:35:50.571925 ARP, Request who-has 192.168.86.246 tell 192.168.2.115, length 46
11:35:50.571926 ARP, Request who-has 192.168.86.247 tell 192.168.2.115, length 46
11:35:50.571927 ARP, Request who-has 192.168.86.248 tell 192.168.2.115, length 46
11:35:50.571928 ARP, Request who-has 192.168.86.249 tell 192.168.2.115, length 46
11:35:50.571929 ARP, Request who-has 192.168.86.250 tell 192.168.2.115, length 46
11:35:50.652455 ARP, Request who-has 10.240.254.112 tell 10.10.19.229, length 46
11:35:50.659343 IP 192.168.2.116.49814 > 239.255.255.250.1900: UDP, length 125
11:35:50.689687 IP 192.168.4.94.40800 > 239.255.255.250.1900: UDP, length 172
11:35:50.754762 IP6 fe80::6f5b:fb22:7f8f:f0aa.mdns > ff02::fb.mdns: 0 A (QM)? slave8.local. (30)
11:35:50.754857 IP 192.168.3.201.mdns > 224.0.0.251.mdns: 0 A (QM)? slave8.local. (30)
11:35:50.770823 IP 192.168.2.94.netbios-ns > 192.168.255.255.netbios-ns: UDP, length 50
11:35:50.770826 IP 192.168.2.94.mdns > 224.0.0.251.mdns: 0 A (QM)? 6EF946000000.local. (36)
11:35:50.772884 IP6 fe80::7c9d:509e:d0f9:3cb3.mdns > ff02::fb.mdns: 0 A (QM)? 6EF946000000.local. (36)
11:35:50.772889 IP 192.168.2.94.mdns > 224.0.0.251.mdns: 0 AAAA (QM)? 6EF946000000.local. (36)
11:35:50.774725 IP6 fe80::7c9d:509e:d0f9:3cb3.mdns > ff02::fb.mdns: 0 AAAA (QM)? 6EF946000000.local. (36)
11:35:50.775556 IP6 fe80::7c9d:509e:d0f9:3cb3.57841 > ff02::1:3.hostmon: UDP, length 30
11:35:50.775558 IP 192.168.2.94.57841 > 224.0.0.252.hostmon: UDP, length 30
11:35:50.783897 IP6 fe80::7c9d:509e:d0f9:3cb3.62310 > ff02::1:3.hostmon: UDP, length 30
11:35:50.784249 IP 192.168.2.94.62310 > 224.0.0.252.hostmon: UDP, length 30
11:35:50.789500 IP 192.168.4.95.58559 > 239.255.255.250.1900: UDP, length 174
11:35:50.812463 ARP, Request who-has 10.1.1.69 tell 10.10.19.229, length 46
11:35:50.825017 IP 192.168.3.127.mdns > 224.0.0.251.mdns: 0*- [0q] 2/0/0 (Cache flush) PTR 17202008-212.local., (Cache flush) AAAA fe80::ab94:ad88:6a52:2cae (144)
11:35:50.842777 IP 192.168.3.158.35740 > 239.255.255.250.1900: UDP, length 171
11:35:50.893536 IP apsit-HP-280-G3-MT.55454 > _gateway.8090: Flags [F.], seq 0, ack 1, win 237, length 0
11:35:50.914764 IP 192.168.5.81.netbios-ns > 192.168.255.255.netbios-ns: UDP, length 50
11:35:50.923614 IP6 fe80::291f:9a3b:8a82:e6fb.dhcpv6-client > ff02::1:2.dhcpv6-server: dhcp6 solicit
11:35:50.951052 IP 192.168.3.199.netbios-ns > 192.168.255.255.netbios-ns: UDP, length 50
11:35:50.987216 ARP, Request who-has 192.168.2.15 tell 192.168.3.93, length 46
11:35:51.035317 ARP, Request who-has 10.1.1.1 tell 10.10.19.229, length 46
11:35:51.068382 IP 192.168.2.250.61588 > 239.255.255.250.1900: UDP, length 173
11:35:51.081037 ARP, Request who-has 192.168.86.159 tell 192.168.2.115, length 46
11:35:51.081039 ARP, Request who-has 192.168.86.161 tell 192.168.2.115, length 46
11:35:51.081040 ARP, Request who-has 192.168.86.158 tell 192.168.2.115, length 46
11:35:51.081041 ARP, Request who-has 192.168.86.157 tell 192.168.2.115, length 46
11:35:51.081041 ARP, Request who-has 192.168.86.160 tell 192.168.2.115, length 46
11:35:51.081042 ARP, Request who-has 192.168.86.162 tell 192.168.2.115, length 46
11:35:51.081043 ARP, Request who-has 192.168.86.156 tell 192.168.2.115, length 46
11:35:51.081044 ARP, Request who-has 192.168.86.163 tell 192.168.2.115, length 46
11:35:51.081044 ARP, Request who-has 192.168.86.164 tell 192.168.2.115, length 46
11:35:51.081045 ARP, Request who-has 192.168.86.167 tell 192.168.2.115, length 46
11:35:51.081046 ARP, Request who-has 192.168.86.170 tell 192.168.2.115, length 46
11:35:51.081046 ARP, Request who-has 192.168.86.168 tell 192.168.2.115, length 46
11:35:51.081047 ARP, Request who-has 192.168.86.169 tell 192.168.2.115, length 46
11:35:51.081048 ARP, Request who-has 192.168.86.179 tell 192.168.2.115, length 46
11:35:51.081113 ARP, Request who-has 192.168.86.172 tell 192.168.2.115, length 46
11:35:51.081115 ARP, Request who-has 192.168.86.171 tell 192.168.2.115, length 46
11:35:51.081116 ARP, Request who-has 192.168.86.178 tell 192.168.2.115, length 46
11:35:51.081117 ARP, Request who-has 192.168.86.182 tell 192.168.2.115, length 46
11:35:51.081117 ARP, Request who-has 192.168.86.176 tell 192.168.2.115, length 46
11:35:51.081118 ARP, Request who-has 192.168.86.175 tell 192.168.2.115, length 46
11:35:51.081118 ARP, Request who-has 192.168.86.177 tell 192.168.2.115, length 46
11:35:51.081119 ARP, Request who-has 192.168.86.174 tell 192.168.2.115, length 46
11:35:51.081120 ARP, Request who-has 192.168.86.173 tell 192.168.2.115, length 46
11:35:51.081121 ARP, Request who-has 192.168.86.183 tell 192.168.2.115, length 46
11:35:51.081121 ARP, Request who-has 192.168.86.180 tell 192.168.2.115, length 46
11:35:51.081122 ARP, Request who-has 192.168.86.181 tell 192.168.2.115, length 46
11:35:51.081192 ARP, Request who-has 192.168.86.186 tell 192.168.2.115, length 46
11:35:51.081195 ARP, Request who-has 192.168.86.185 tell 192.168.2.115, length 46
11:35:51.146365 ARP, Request who-has 192.168.86.187 tell 192.168.2.115, length 46
11:35:51.189455 IP6 fe80::7c9d:509e:d0f9:3cb3.62310 > ff02::1:3.hostmon: UDP, length 30
11:35:51.189459 IP6 fe80::7c9d:509e:d0f9:3cb3.57841 > ff02::1:3.hostmon: UDP, length 30
11:35:51.189460 IP 192.168.2.94.57841 > 224.0.0.252.hostmon: UDP, length 30
11:35:51.189461 IP 192.168.2.94.62310 > 224.0.0.252.hostmon: UDP, length 30
11:35:51.203615 LLDP, length 157: Lab315
11:35:51.251389 ec:58:ea:00:7d:00 (oui Unknown) > Broadcast, ethertype Unknown (0x99ea), length 367: 
	0x0000:  0000 0003 0000 016f 5235 3130 0000 0000  .......oR510....
	0x0010:  0000 0000 0000 0000 0000 0000 0000 0000  ................
	0x0020:  0000 0000 0000 0000 3139 3138 3339 3030  ........19183900
	0x0030:  3033 3130 0000 0000 0000 0000 0000 0000  0310............
	0x0040:  0000 0000 0000 0000 ec58 ea00 7d00 0000  .........X..}...
	0x0050:  0000 0000 0035 0004 c784 f937 1200 9f51  .....5.....7...Q
	0x0060:  335b 0012 37b0 0002 c344 0200 0000 c0a8  3[..7....D......
	0x0070:  45ea 0000 0000 0000 0000 0000 0003 3230  E.............20
	0x0080:  302e 362e 3130 2e31 2e33 3130 0000 0000  0.6.10.1.310....
	0x0090:  0000 0000 0000 0000 0000 0000 0000 3230  ..............20
	0x00a0:  302e 332e 392e 3133 2e32 3238 0000 0000  0.3.9.13.228....
	0x00b0:  0000 0000 0000 0000 0000 0000 0000 7235  ..............r5
	0x00c0:  3130 0000 0000 0000 0000 5354 4146 462d  10........STAFF-
	0x00d0:  3330 3500 0000 0000 0000 0000 0000 0000  305.............
	0x00e0:  0000 0000 0000 0000 0000 3500 0000 0000  ..........5.....
	0x00f0:  0000 3331 0000 0000 0000 3462 7373 0000  ..31......4bss..
	0x0100:  0000 0000 0000 0000 0000 0000 0000 0000  ................
	0x0110:  0000 0000 0000 0000 0000 0000 0000 0100  ................
	0x0120:  0101 0000 0000 0000 0173 7461 7469 6300  .........static.
	0x0130:  0031 3932 2e31 3638 2e31 3030 2e31 3030  .192.168.100.100
	0x0140:  0000 0000 0002 0000 00ff ff00 0000 0000  ................
	0x0150:  0000 0000 0000 1237 f900 0000 0000 0000  .......7........
	0x0160:  00                                       .
11:35:51.257743 IP6 apsit-HP-280-G3-MT.mdns > ff02::fb.mdns: 0 PTR (QM)? 254.169.254.169.in-addr.arpa. (46)
11:35:51.257767 IP apsit-HP-280-G3-MT.mdns > 224.0.0.251.mdns: 0 PTR (QM)? 254.169.254.169.in-addr.arpa. (46)
11:35:51.261585 IP 192.168.69.234.42877 > 192.168.255.255.60000: UDP, length 345
11:35:51.271737 IP 192.168.8.38.40620 > 239.255.255.250.1900: UDP, length 171
11:35:51.272982 IP 192.168.3.127.47655 > 239.255.255.250.1900: UDP, length 172
11:35:51.279520 ARP, Request who-has 169.254.169.254 tell 192.168.2.191, length 46
11:35:51.297599 IP 192.168.4.61.bootpc > 255.255.255.255.bootps: BOOTP/DHCP, Request from 00:23:4d:20:03:3d (oui Unknown), length 300
11:35:51.342377 IP6 fe80::2dbd:569a:21de:db5e.61636 > ff02::1:3.hostmon: UDP, length 22
11:35:51.345167 IP 192.168.4.61.57072 > 224.0.0.252.hostmon: UDP, length 22
11:35:51.377279 IP 192.168.3.6.64130 > 239.255.255.250.1900: UDP, length 173
11:35:51.394488 ARP, Request who-has 192.168.86.190 tell 192.168.2.115, length 46
11:35:51.394494 ARP, Request who-has 192.168.86.189 tell 192.168.2.115, length 46
11:35:51.415104 ARP, Request who-has 192.168.86.191 tell 192.168.2.115, length 46
11:35:51.430105 IP ec2-3-109-249-192.ap-south-1.compute.amazonaws.com.xmpp-client > 192.168.2.39.46622: Flags [F.], seq 0, ack 1, win 181, options [nop,nop,TS val 3434891872 ecr 28964971], length 0
11:35:51.443379 IP6 fe80::2dbd:569a:21de:db5e.61636 > ff02::1:3.hostmon: UDP, length 22
11:35:51.443507 IP 192.168.4.61.57072 > 224.0.0.252.hostmon: UDP, length 22
11:35:51.450886 IP 192.168.8.44.33627 > 239.255.255.250.1900: UDP, length 166
11:35:51.477463 IP 192.168.15.123.55858 > 192.168.255.255.1947: UDP, length 40
11:35:51.495972 IP 192.168.3.168.45763 > 239.255.255.250.1900: UDP, length 171
11:35:51.502538 ARP, Request who-has 192.168.2.90 tell 192.168.2.187, length 46
11:35:51.522413 CDPv2, ttl: 180s, Device-ID 'PCT247', length 353
11:35:51.530527 IP 192.168.2.94.netbios-ns > 192.168.255.255.netbios-ns: UDP, length 50
11:35:51.574862 ARP, Request who-has 192.168.86.165 tell 192.168.2.115, length 46
11:35:51.574868 ARP, Request who-has 192.168.86.251 tell 192.168.2.115, length 46
11:35:51.574869 ARP, Request who-has 192.168.86.252 tell 192.168.2.115, length 46
11:35:51.574869 ARP, Request who-has 192.168.86.253 tell 192.168.2.115, length 46
11:35:51.574870 ARP, Request who-has 192.168.86.254 tell 192.168.2.115, length 46
11:35:51.574870 ARP, Request who-has 192.168.86.255 tell 192.168.2.115, length 46
11:35:51.593263 ARP, Request who-has 10.240.254.115 tell 10.10.19.229, length 46
11:35:51.633987 ARP, Request who-has 192.168.2.15 tell 192.168.3.93, length 46
11:35:51.643517 IP 192.168.4.61.netbios-ns > 192.168.255.255.netbios-ns: UDP, length 50
11:35:51.655574 ARP, Request who-has _gateway tell 192.168.2.124, length 46
11:35:51.657888 ARP, Request who-has 192.168.86.192 tell 192.168.2.115, length 46
11:35:51.680431 ARP, Request who-has 10.240.254.112 tell 10.10.19.229, length 46
11:35:51.690771 IP 192.168.4.94.40800 > 239.255.255.250.1900: UDP, length 172
11:35:51.702342 IP 192.168.3.199.netbios-ns > 192.168.255.255.netbios-ns: UDP, length 50
11:35:51.712403 IP 192.168.3.115.53326 > 239.255.255.250.1900: UDP, length 171
11:35:51.739406 ARP, Request who-has _gateway tell 192.168.2.209, length 46
11:35:51.756077 IP6 fe80::6f5b:fb22:7f8f:f0aa.mdns > ff02::fb.mdns: 0 A (QM)? slave8.local. (30)
11:35:51.756130 IP 192.168.3.201.mdns > 224.0.0.251.mdns: 0 A (QM)? slave8.local. (30)
11:35:51.785141 IP 192.168.2.94.mdns > 224.0.0.251.mdns: 0 AAAA (QM)? 6EF946000000.local. (36)
11:35:51.785155 IP6 fe80::7c9d:509e:d0f9:3cb3.mdns > ff02::fb.mdns: 0 AAAA (QM)? 6EF946000000.local. (36)
11:35:51.785160 IP 192.168.2.94.mdns > 224.0.0.251.mdns: 0 A (QM)? 6EF946000000.local. (36)
11:35:51.785162 IP6 fe80::7c9d:509e:d0f9:3cb3.mdns > ff02::fb.mdns: 0 A (QM)? 6EF946000000.local. (36)
11:35:51.790285 IP 192.168.4.95.58559 > 239.255.255.250.1900: UDP, length 174
11:35:51.800353 ARP, Request who-has 192.168.86.193 tell 192.168.2.115, length 46
11:35:51.800358 ARP, Request who-has 192.168.86.198 tell 192.168.2.115, length 46
11:35:51.800358 ARP, Request who-has 192.168.86.199 tell 192.168.2.115, length 46
11:35:51.816069 ARP, Request who-has 192.168.86.208 tell 192.168.2.115, length 46
11:35:51.816075 ARP, Request who-has 192.168.86.201 tell 192.168.2.115, length 46
11:35:51.816076 ARP, Request who-has 192.168.86.202 tell 192.168.2.115, length 46
11:35:51.816076 ARP, Request who-has 192.168.86.206 tell 192.168.2.115, length 46
11:35:51.816077 ARP, Request who-has 192.168.86.207 tell 192.168.2.115, length 46
11:35:51.816077 ARP, Request who-has 192.168.86.211 tell 192.168.2.115, length 46
11:35:51.816078 ARP, Request who-has 192.168.86.209 tell 192.168.2.115, length 46
11:35:51.816079 ARP, Request who-has 192.168.86.210 tell 192.168.2.115, length 46
11:35:51.816079 ARP, Request who-has 192.168.86.212 tell 192.168.2.115, length 46
11:35:51.816081 ARP, Request who-has 192.168.86.218 tell 192.168.2.115, length 46
11:35:51.816081 ARP, Request who-has 192.168.86.203 tell 192.168.2.115, length 46
11:35:51.816082 ARP, Request who-has 192.168.86.215 tell 192.168.2.115, length 46
11:35:51.821454 ARP, Request who-has 192.168.87.18 tell 192.168.2.115, length 46
11:35:51.822110 ARP, Request who-has 192.168.87.19 tell 192.168.2.115, length 46
11:35:51.822486 ARP, Request who-has 192.168.87.20 tell 192.168.2.115, length 46
11:35:51.823414 ARP, Request who-has 192.168.87.21 tell 192.168.2.115, length 46
11:35:51.823936 ARP, Request who-has 192.168.87.25 tell 192.168.2.115, length 46
11:35:51.824449 ARP, Request who-has 192.168.87.22 tell 192.168.2.115, length 46
11:35:51.824911 ARP, Request who-has 192.168.87.26 tell 192.168.2.115, length 46
11:35:51.825449 ARP, Request who-has 192.168.87.24 tell 192.168.2.115, length 46
11:35:51.833580 IP 192.168.3.57.mdns > 224.0.0.251.mdns: 0 [2q] [2n] ANY (QM)? 0.4.e.9.a.0.d.c.d.9.d.6.6.c.2.4.0.0.0.0.0.0.0.0.0.0.0.0.0.8.e.f.ip6.arpa. ANY (QM)? 15202005-311.local. (156)
11:35:51.834495 IP 192.168.2.146.mdns > 224.0.0.251.mdns: 0*- [0q] 1/0/0 (Cache flush) PTR 15102058-393.local. (116)
11:35:51.836449 ARP, Request who-has 10.1.1.69 tell 10.10.19.229, length 46
11:35:51.843696 IP 192.168.3.158.35740 > 239.255.255.250.1900: UDP, length 171
11:35:51.857385 ARP, Request who-has 192.168.2.145 tell 192.168.2.136, length 46
11:35:52.060433 ARP, Request who-has 10.1.1.1 tell 10.10.19.229, length 46
11:35:52.067873 ARP, Request who-has 192.168.86.167 tell 192.168.2.115, length 46
11:35:52.067890 ARP, Request who-has 192.168.86.170 tell 192.168.2.115, length 46
11:35:52.067891 ARP, Request who-has 192.168.86.168 tell 192.168.2.115, length 46
11:35:52.067891 ARP, Request who-has 192.168.86.169 tell 192.168.2.115, length 46
11:35:52.067892 ARP, Request who-has 192.168.86.179 tell 192.168.2.115, length 46
11:35:52.067893 ARP, Request who-has 192.168.86.172 tell 192.168.2.115, length 46
11:35:52.067894 ARP, Request who-has 192.168.86.171 tell 192.168.2.115, length 46
11:35:52.067894 ARP, Request who-has 192.168.86.178 tell 192.168.2.115, length 46
11:35:52.067895 ARP, Request who-has 192.168.86.182 tell 192.168.2.115, length 46
11:35:52.067896 ARP, Request who-has 192.168.86.176 tell 192.168.2.115, length 46
11:35:52.067896 ARP, Request who-has 192.168.86.175 tell 192.168.2.115, length 46
11:35:52.067897 ARP, Request who-has 192.168.86.177 tell 192.168.2.115, length 46
11:35:52.067897 ARP, Request who-has 192.168.86.174 tell 192.168.2.115, length 46
11:35:52.067898 ARP, Request who-has 192.168.86.173 tell 192.168.2.115, length 46
11:35:52.067927 ARP, Request who-has 192.168.86.183 tell 192.168.2.115, length 46
11:35:52.067928 ARP, Request who-has 192.168.86.180 tell 192.168.2.115, length 46
11:35:52.067929 ARP, Request who-has 192.168.86.181 tell 192.168.2.115, length 46
11:35:52.067929 ARP, Request who-has 192.168.86.186 tell 192.168.2.115, length 46
11:35:52.067936 ARP, Request who-has 192.168.86.185 tell 192.168.2.115, length 46
11:35:52.067937 ARP, Request who-has 192.168.86.187 tell 192.168.2.115, length 46
11:35:52.067938 ARP, Request who-has 192.168.86.190 tell 192.168.2.115, length 46
11:35:52.067938 ARP, Request who-has 192.168.86.189 tell 192.168.2.115, length 46
11:35:52.067939 ARP, Request who-has 192.168.86.191 tell 192.168.2.115, length 46
11:35:52.067946 ARP, Request who-has 192.168.87.0 tell 192.168.2.115, length 46
11:35:52.067947 ARP, Request who-has 192.168.87.1 tell 192.168.2.115, length 46
11:35:52.067948 ARP, Request who-has 192.168.87.3 tell 192.168.2.115, length 46
11:35:52.068053 ARP, Request who-has 192.168.87.2 tell 192.168.2.115, length 46
11:35:52.068055 ARP, Request who-has 192.168.87.4 tell 192.168.2.115, length 46
11:35:52.068056 ARP, Request who-has 192.168.87.5 tell 192.168.2.115, length 46
11:35:52.068057 ARP, Request who-has 192.168.87.6 tell 192.168.2.115, length 46
11:35:52.068058 ARP, Request who-has 192.168.87.7 tell 192.168.2.115, length 46
11:35:52.068058 ARP, Request who-has 192.168.87.8 tell 192.168.2.115, length 46
11:35:52.068059 ARP, Request who-has 192.168.87.9 tell 192.168.2.115, length 46
11:35:52.068060 ARP, Request who-has 192.168.87.11 tell 192.168.2.115, length 46
11:35:52.068060 ARP, Request who-has 192.168.87.10 tell 192.168.2.115, length 46
11:35:52.068061 ARP, Request who-has 192.168.87.12 tell 192.168.2.115, length 46
11:35:52.068062 ARP, Request who-has 192.168.87.13 tell 192.168.2.115, length 46
11:35:52.068063 ARP, Request who-has 192.168.87.14 tell 192.168.2.115, length 46
11:35:52.068063 ARP, Request who-has 192.168.87.15 tell 192.168.2.115, length 46
11:35:52.068064 ARP, Request who-has 192.168.87.16 tell 192.168.2.115, length 46
11:35:52.068065 ARP, Request who-has 192.168.87.17 tell 192.168.2.115, length 46
11:35:52.068065 ARP, Request who-has 192.168.87.23 tell 192.168.2.115, length 46
11:35:52.083801 IP 192.168.2.250.61588 > 239.255.255.250.1900: UDP, length 173
11:35:52.222656 IP 192.168.4.25.54807 > 239.255.255.250.1900: UDP, length 171
11:35:52.250727 ARP, Request who-has 192.168.86.219 tell 192.168.2.115, length 46
11:35:52.266590 IP6 fe80::763e:2bff:fe03:5de0 > ff02::16: HBH ICMP6, multicast listener report v2, 1 group record(s), length 28
11:35:52.272299 IP 192.168.8.38.40620 > 239.255.255.250.1900: UDP, length 171
11:35:52.292013 IP 192.168.2.94.netbios-ns > 192.168.255.255.netbios-ns: UDP, length 50
11:35:52.298589 IP 192.168.2.116.mdns > 224.0.0.251.mdns: 7 [2q] PTR (QM)? _233637DE._sub._googlecast._tcp.local. PTR (QM)? _googlecast._tcp.local. (61)
11:35:52.393690 IP 192.168.4.61.netbios-ns > 192.168.255.255.netbios-ns: UDP, length 50
11:35:52.447601 ARP, Request who-has 192.168.86.222 tell 192.168.2.115, length 46
11:35:52.447605 ARP, Request who-has 192.168.86.224 tell 192.168.2.115, length 46
11:35:52.447605 ARP, Request who-has 192.168.86.227 tell 192.168.2.115, length 46
11:35:52.447606 ARP, Request who-has 192.168.86.228 tell 192.168.2.115, length 46
11:35:52.447607 ARP, Request who-has 192.168.86.221 tell 192.168.2.115, length 46
11:35:52.447608 ARP, Request who-has 192.168.86.225 tell 192.168.2.115, length 46
11:35:52.447608 ARP, Request who-has 192.168.86.226 tell 192.168.2.115, length 46
11:35:52.447609 ARP, Request who-has 192.168.86.223 tell 192.168.2.115, length 46
11:35:52.447609 ARP, Request who-has 192.168.86.220 tell 192.168.2.115, length 46
11:35:52.451834 IP 192.168.8.44.33627 > 239.255.255.250.1900: UDP, length 166
11:35:52.461763 IP 192.168.3.199.netbios-ns > 192.168.255.255.netbios-ns: UDP, length 50
11:35:52.484392 ARP, Request who-has 10.240.254.111 tell 10.10.19.229, length 46
11:35:52.485540 ARP, Request who-has 10.240.254.113 tell 10.10.19.229, length 46
11:35:52.541877 IP 192.168.4.44.56660 > 239.255.255.250.1900: UDP, length 172
11:35:52.547809 IP 192.168.69.230.12223 > 192.168.255.255.12223: LWAPPv0, Data frame, Flags [Last Fragment Bit], length 335
11:35:52.575872 ARP, Request who-has 192.168.86.192 tell 192.168.2.115, length 46
11:35:52.575876 ARP, Request who-has 192.168.86.193 tell 192.168.2.115, length 46
11:35:52.575876 ARP, Request who-has 192.168.86.198 tell 192.168.2.115, length 46
11:35:52.575877 ARP, Request who-has 192.168.86.199 tell 192.168.2.115, length 46
11:35:52.575878 ARP, Request who-has 192.168.86.208 tell 192.168.2.115, length 46
11:35:52.575878 ARP, Request who-has 192.168.86.201 tell 192.168.2.115, length 46
11:35:52.575879 ARP, Request who-has 192.168.86.202 tell 192.168.2.115, length 46
11:35:52.575879 ARP, Request who-has 192.168.86.206 tell 192.168.2.115, length 46
11:35:52.575880 ARP, Request who-has 192.168.86.207 tell 192.168.2.115, length 46
11:35:52.575881 ARP, Request who-has 192.168.86.211 tell 192.168.2.115, length 46
11:35:52.575882 ARP, Request who-has 192.168.86.209 tell 192.168.2.115, length 46
11:35:52.575882 ARP, Request who-has 192.168.86.210 tell 192.168.2.115, length 46
11:35:52.575883 ARP, Request who-has 192.168.86.212 tell 192.168.2.115, length 46
11:35:52.575884 ARP, Request who-has 192.168.86.218 tell 192.168.2.115, length 46
11:35:52.575950 ARP, Request who-has 192.168.86.203 tell 192.168.2.115, length 46
11:35:52.575952 ARP, Request who-has 192.168.86.215 tell 192.168.2.115, length 46
11:35:52.575953 ARP, Request who-has 192.168.87.18 tell 192.168.2.115, length 46
11:35:52.575954 ARP, Request who-has 192.168.87.19 tell 192.168.2.115, length 46
11:35:52.575955 ARP, Request who-has 192.168.87.20 tell 192.168.2.115, length 46
11:35:52.575955 ARP, Request who-has 192.168.87.21 tell 192.168.2.115, length 46
11:35:52.575956 ARP, Request who-has 192.168.87.25 tell 192.168.2.115, length 46
11:35:52.575957 ARP, Request who-has 192.168.87.22 tell 192.168.2.115, length 46
11:35:52.575957 ARP, Request who-has 192.168.87.26 tell 192.168.2.115, length 46
11:35:52.575958 ARP, Request who-has 192.168.87.24 tell 192.168.2.115, length 46
11:35:52.575958 ARP, Request who-has 192.168.87.27 tell 192.168.2.115, length 46
11:35:52.575959 ARP, Request who-has 192.168.87.28 tell 192.168.2.115, length 46
11:35:52.576032 ARP, Request who-has 192.168.87.29 tell 192.168.2.115, length 46
11:35:52.576035 ARP, Request who-has 192.168.87.30 tell 192.168.2.115, length 46
11:35:52.576035 ARP, Request who-has 192.168.87.31 tell 192.168.2.115, length 46
11:35:52.576036 ARP, Request who-has 192.168.87.32 tell 192.168.2.115, length 46
11:35:52.576036 ARP, Request who-has 192.168.87.33 tell 192.168.2.115, length 46
11:35:52.576037 ARP, Request who-has 192.168.87.34 tell 192.168.2.115, length 46
11:35:52.576039 ARP, Request who-has 192.168.87.35 tell 192.168.2.115, length 46
11:35:52.576054 ARP, Request who-has 192.168.87.36 tell 192.168.2.115, length 46
11:35:52.604465 ARP, Request who-has 10.240.254.115 tell 10.10.19.229, length 46
11:35:52.620049 ARP, Request who-has 192.168.2.145 tell 192.168.2.136, length 46
11:35:52.643421 ARP, Request who-has 192.168.2.15 tell 192.168.3.93, length 46
11:35:52.654594 IP 192.168.2.146.mdns > 224.0.0.251.mdns: 0 [2q] [2n] ANY (QM)? 146.2.168.192.in-addr.arpa. ANY (QM)? 15102058-393.local. (98)
